<!ELEMENT students (student*)>
<!ELEMENT student (name,age,school)>
<!ELEMENT name (#PCDATA)>
<!ELEMENT age (#PCDATA)>
<!ELEMENT school (#PCDATA)>